{
  "schema": "enfractal.asset",
  "version": 1,
  "asset_id": "doorstop_proxy",
  "display_name": "Doorstop",
  "category": "rubber doorstop",
  "category_group": "tool",
  "tier": "proxy",
  "provenance": {
    "kind": "placeholder",
    "license": "Original EnFractal placeholder; CC0-1.0",
    "created_utc": "2026-10-06T00:00:00Z",
    "notes": "Primitive stand-in at real furniture size so scale reads from the small avatar."
  },
  "pivot": "bottom_center",
  "dimensions_m": [
    0.12,
    0.04,
    0.08
  ],
  "geometry": {
    "kind": "primitive",
    "primitive": "box"
  },
  "collision": {
    "kind": "primitive"
  },
  "physics": {
    "movable": true,
    "mass_kg": 0.3
  },
  "materials": [
    {
      "slot": "body",
      "role": "rubber",
      "base_color": "#6d6d6d"
    }
  ],
  "affordances": [
    "walkable_top",
    "climbable"
  ],
  "review": {
    "status": "approved",
    "reviewer": "integrator",
    "notes": "Placeholder geometry; approved as a test fixture only."
  },
  "files": []
}
