{
  "schema": "enfractal.asset",
  "version": 1,
  "asset_id": "table_proxy",
  "display_name": "Table",
  "category": "low table",
  "category_group": "furniture",
  "tier": "proxy",
  "provenance": {
    "kind": "placeholder",
    "license": "Original EnFractal placeholder; CC0-1.0",
    "created_utc": "2026-10-06T00:00:00Z",
    "notes": "Primitive stand-in at real furniture size so scale reads from the small avatar."
  },
  "pivot": "bottom_center",
  "dimensions_m": [
    1.2,
    0.75,
    0.6
  ],
  "geometry": {
    "kind": "primitive",
    "primitive": "box"
  },
  "collision": {
    "kind": "primitive"
  },
  "physics": {
    "movable": true,
    "mass_kg": 25.0
  },
  "materials": [
    {
      "slot": "body",
      "role": "wood",
      "base_color": "#9a6f45"
    }
  ],
  "affordances": [
    "walkable_top",
    "climbable"
  ],
  "review": {
    "status": "approved",
    "reviewer": "integrator",
    "notes": "Placeholder geometry; approved as a test fixture only."
  },
  "files": []
}
