{
  "schema": "enfractal.asset",
  "version": 1,
  "asset_id": "box_proxy",
  "display_name": "Cardboard box",
  "category": "cardboard box",
  "category_group": "container",
  "tier": "proxy",
  "provenance": {
    "kind": "placeholder",
    "license": "Original EnFractal placeholder; CC0-1.0",
    "created_utc": "2026-10-06T00:00:00Z",
    "notes": "Primitive stand-in at real furniture size so scale reads from the small avatar."
  },
  "pivot": "bottom_center",
  "dimensions_m": [
    0.35,
    0.3,
    0.35
  ],
  "geometry": {
    "kind": "primitive",
    "primitive": "box"
  },
  "collision": {
    "kind": "primitive"
  },
  "physics": {
    "movable": true,
    "mass_kg": 1.5
  },
  "materials": [
    {
      "slot": "body",
      "role": "cardboard",
      "base_color": "#b08a5a"
    }
  ],
  "affordances": [
    "walkable_top",
    "climbable",
    "container"
  ],
  "review": {
    "status": "approved",
    "reviewer": "integrator",
    "notes": "Placeholder geometry; approved as a test fixture only."
  },
  "files": []
}
